<?xml version="1.0" encoding="iso-8859-1"?>

<!ELEMENT elements (element+)>
<!ELEMENT element (#PCDATA)>
<!ATTLIST element ref NMTOKENS #REQUIRED>
<!ATTLIST element type CDATA #REQUIRED>